{
  "schema_version": "1.0.0",
  "source": "salesforce",
  "source_id": "5008W00002aQpLrQAK",
  "title": "GL sync drops credit memo lines",
  "account_id": "ACC-0003",
  "account_name": "Prairie Land Trust Council",
  "occurred_at": "2026-09-10T13:58:41Z",
  "doc_type": "case",
  "ingest_run_id": "2026-09-10T06:00Z",
  "scrubbed": true,
  "pii_counts": {
    "EMAIL": 0,
    "PHONE": 0,
    "ADDRESS": 0,
    "NAME": 1
  },
  "participants": [
    {
      "id": "0058W00000abcDEQAY",
      "name": "Jamie Cole",
      "side": "client",
      "title": null
    }
  ],
  "turns": [
    {
      "ref": {
        "case_id": "5008W00002aQpLrQAK",
        "case_number": "00001042",
        "comment_id": "00a8W00000XfT2mQAF",
        "author_id": "0058W00000abcDEQAY",
        "author_name": "Jamie Cole",
        "created_at": "2026-09-10T13:58:41Z"
      },
      "speaker_id": "0058W00000abcDEQAY",
      "speaker_side": "client",
      "text": "The GL sync drops the credit memo lines entirely when the batch runs overnight.",
      "sentences": []
    }
  ],
  "meta": {
    "withheld_comment_count": 1,
    "turn_count": 1,
    "soql": "SELECT Id FROM Case WHERE Id = '5008W00002aQpLrQAK'"
  }
}
